{
  "meta": {
    "component": "Link",
    "library": "dsKit",
    "fileKey": "EXAMPLE_FILE_KEY",
    "nodeId": "0:0",
    "componentKey": "675f7f8d0d57162e4cce51d26cbe39cf490e9b8d",
    "generatedAt": "2026-04-03T00:00:00Z",
    "skill": "component-brief",
    "pluginVersion": "1.57.2",
    "model": "claude-opus-4-6",
    "duration": "45s"
  },
  "card1_header": {
    "cardTitle": "Page header",
    "cardSubtitle": "Component name and description",
    "name": "Link",
    "description": "A Link visually represents clickable text or elements that navigate users to other pages, sections, or resources. It appears colored to indicate interactivity and follows accessibility and design standards for clarity and usability."
  },
  "card2_component": {
    "cardTitle": "Component",
    "cardSubtitle": "Live component across all states and theme modes",
    "variantAxes": [
      {
        "axis": "State",
        "values": [
          "Enabled",
          "Hovered",
          "Focused",
          "Pressed",
          "Once clicked",
          "Disabled"
        ]
      }
    ],
    "variantMatrix": [
      {
        "row": "Link",
        "columns": [
          {
            "variantName": "State=Enabled",
            "label": "Enabled"
          },
          {
            "variantName": "State=Hovered",
            "label": "Hovered"
          },
          {
            "variantName": "State=Focused",
            "label": "Focused"
          },
          {
            "variantName": "State=Pressed",
            "label": "Pressed"
          },
          {
            "variantName": "State=Once clicked",
            "label": "Once clicked"
          },
          {
            "variantName": "State=Disabled",
            "label": "Disabled"
          }
        ]
      }
    ],
    "themeVariant": "State=Enabled"
  },
  "card3_anatomy": {
    "cardTitle": "Anatomy",
    "cardSubtitle": "Component structure, dimensions, interactive states, and part-level token mapping",
    "parts": [
      {
        "letter": "A",
        "name": "Link text",
        "description": "The visible clickable text label styled with theme color and optional underline decoration",
        "figmaLayerName": "Link text"
      },
      {
        "letter": "B",
        "name": "Trailing icon",
        "description": "Optional icon following the text, indicates external navigation or additional context",
        "figmaLayerName": "Icon"
      },
      {
        "letter": "C",
        "name": "Focus ring",
        "description": "2px outline around the link for keyboard focus indication, offset by 2px",
        "figmaLayerName": "Focus ring"
      },
      {
        "letter": "D",
        "name": "Underline",
        "description": "Text decoration that appears on hover/focus states to reinforce interactivity",
        "figmaLayerName": "Underline"
      }
    ],
    "states": [
      "Enabled",
      "Hovered",
      "Focused",
      "Pressed",
      "Once clicked",
      "Disabled"
    ],
    "partsTable": [
      {
        "part": "A",
        "element": "Link text",
        "token": "--zen-font-body-standard, theme-primary",
        "notes": "Roboto 400 14px/20px, inherits theme color"
      },
      {
        "part": "B",
        "element": "Trailing icon",
        "token": "theme-primary",
        "notes": "16×16px, same color as text"
      },
      {
        "part": "C",
        "element": "Focus ring",
        "token": "theme-primary",
        "notes": "2px solid, 2px offset, rounded"
      },
      {
        "part": "D",
        "element": "Underline",
        "token": "theme-primary",
        "notes": "Appears on hover and focus states"
      }
    ]
  },
  "card4_tokens": {
    "cardTitle": "Design tokens",
    "cardSubtitle": "Color, sizing, and typography tokens",
    "colorTokens": [
      {
        "state": "Enabled",
        "columns": [
          {
            "header": "Text",
            "token": "theme-primary",
            "hex": "#0550DC"
          },
          {
            "header": "Icon",
            "token": "theme-primary",
            "hex": "#0550DC"
          },
          {
            "header": "Underline",
            "token": "—",
            "hex": "transparent"
          }
        ]
      },
      {
        "state": "Hovered",
        "columns": [
          {
            "header": "Text",
            "token": "theme-primary-hover",
            "hex": "#0343B5"
          },
          {
            "header": "Icon",
            "token": "theme-primary-hover",
            "hex": "#0343B5"
          },
          {
            "header": "Underline",
            "token": "theme-primary-hover",
            "hex": "#0343B5"
          }
        ]
      },
      {
        "state": "Focused",
        "columns": [
          {
            "header": "Text",
            "token": "theme-primary",
            "hex": "#0550DC"
          },
          {
            "header": "Icon",
            "token": "theme-primary",
            "hex": "#0550DC"
          },
          {
            "header": "Underline",
            "token": "theme-primary",
            "hex": "#0550DC"
          }
        ]
      },
      {
        "state": "Pressed",
        "columns": [
          {
            "header": "Text",
            "token": "theme-primary-pressed",
            "hex": "#023699"
          },
          {
            "header": "Icon",
            "token": "theme-primary-pressed",
            "hex": "#023699"
          },
          {
            "header": "Underline",
            "token": "theme-primary-pressed",
            "hex": "#023699"
          }
        ]
      },
      {
        "state": "Disabled",
        "columns": [
          {
            "header": "Text",
            "token": "text-disabled",
            "hex": "#9898A7"
          },
          {
            "header": "Icon",
            "token": "text-disabled",
            "hex": "#9898A7"
          },
          {
            "header": "Underline",
            "token": "—",
            "hex": "transparent"
          }
        ]
      }
    ],
    "sizingTokens": [
      {
        "property": "Icon size",
        "token": "--zen-size-md",
        "value": "16px"
      },
      {
        "property": "Text-to-icon gap",
        "token": "--zen-spacing-2xs",
        "value": "4px"
      },
      {
        "property": "Focus ring offset",
        "token": "--zen-spacing-3xs",
        "value": "2px"
      },
      {
        "property": "Focus ring width",
        "token": "—",
        "value": "2px"
      }
    ],
    "typography": [
      {
        "element": "Link text",
        "token": "body-standard",
        "font": "Roboto Regular 14px/20px",
        "tracking": "0.2px"
      }
    ]
  },
  "card5_api": {
    "cardTitle": "Component API",
    "cardSubtitle": "Properties, types, defaults, and allowed values",
    "props": [
      {
        "required": true,
        "name": "href",
        "type": "string",
        "default": "—",
        "values": "any URL",
        "notes": "Navigation destination"
      },
      {
        "required": true,
        "name": "children",
        "type": "ReactNode",
        "default": "—",
        "values": "text content",
        "notes": "Visible link label"
      },
      {
        "required": false,
        "name": "variant",
        "type": "enum",
        "default": "\"link\"",
        "values": "\"link\" | \"link-with-icon\"",
        "notes": "Link type with optional trailing icon"
      },
      {
        "required": false,
        "name": "external",
        "type": "boolean",
        "default": "false",
        "values": "true | false",
        "notes": "Opens in new tab with rel=noopener"
      },
      {
        "required": false,
        "name": "disabled",
        "type": "boolean",
        "default": "false",
        "values": "true | false",
        "notes": "Disables interaction, applies muted styling"
      },
      {
        "required": false,
        "name": "icon",
        "type": "ReactNode",
        "default": "—",
        "values": "icon element",
        "notes": "Trailing icon (only when variant is link-with-icon)"
      },
      {
        "required": false,
        "name": "onClick",
        "type": "function",
        "default": "—",
        "values": "(e) => void",
        "notes": "Click handler, fires before navigation"
      }
    ]
  },
  "card6_usage": {
    "cardTitle": "Usage guidelines",
    "cardSubtitle": "When and how to use this component",
    "whenToUse": [
      "Navigation to internal or external destinations (pages, sections, resources)",
      "Inline contextual navigation within body text or descriptions",
      "Standalone navigation elements like breadcrumbs or footer links"
    ],
    "whenNotToUse": [
      "Actions that don't navigate (submit, delete, toggle) → use Button",
      "Primary call-to-action → use Button with appropriate hierarchy",
      "Standalone icons as navigation → use Icon Button instead"
    ],
    "doDont": [
      {
        "doLabel": "Use for navigation",
        "doDetail": "Links should always navigate to a destination — a new page, section, or external resource.",
        "dontLabel": "Use for actions",
        "dontDetail": "Don't use links for actions like submitting a form or deleting an item. Use ghost buttons instead."
      },
      {
        "doLabel": "Use descriptive text",
        "doDetail": "Link text should describe the destination clearly, e.g., 'View pipeline details'.",
        "dontLabel": "Use vague text",
        "dontDetail": "Avoid generic labels like 'Click here', 'Read more', or raw URLs as link text."
      },
      {
        "doLabel": "Indicate external links",
        "doDetail": "Add a trailing icon or label when the link opens in a new tab or goes to an external site.",
        "dontLabel": "Surprise navigation",
        "dontDetail": "Don't open links in new tabs without visual indication — users should anticipate the behavior."